{
  "schema_version": "1.0.0",
  "record_type": "topic",
  "record_kind": "live",
  "topic_id": "exceptions",
  "title": "Java exceptions and resource handling",
  "status": "learning",
  "selection": "accepted",
  "updated_from_lesson_id": "lesson-0002",
  "evidence_refs": [
    {
      "lesson_id": "lesson-0002",
      "evidence_id": "evidence-01"
    },
    {
      "lesson_id": "lesson-0002",
      "evidence_id": "evidence-02"
    },
    {
      "lesson_id": "lesson-0002",
      "evidence_id": "evidence-03"
    },
    {
      "lesson_id": "lesson-0002",
      "evidence_id": "evidence-04"
    },
    {
      "lesson_id": "lesson-0002",
      "evidence_id": "evidence-05"
    },
    {
      "lesson_id": "lesson-0002",
      "evidence_id": "evidence-06"
    },
    {
      "lesson_id": "lesson-0002",
      "evidence_id": "evidence-07"
    },
    {
      "lesson_id": "lesson-0002",
      "evidence_id": "evidence-08"
    },
    {
      "lesson_id": "lesson-0002",
      "evidence_id": "evidence-09"
    },
    {
      "lesson_id": "lesson-0002",
      "evidence_id": "evidence-10"
    },
    {
      "lesson_id": "lesson-0002",
      "evidence_id": "evidence-11"
    }
  ],
  "gaps": [
    "Explain finally completion when earlier control flow is pending.",
    "Apply checked and unchecked exception rules without assistance.",
    "Explain primary and suppressed exceptions in try-with-resources.",
    "Apply checked exception restrictions when overriding methods."
  ],
  "review": {
    "last_review_lesson_id": null,
    "next_due_on": null
  }
}
