{
  "schema_version": "1.0.0",
  "record_type": "topic",
  "record_kind": "example",
  "topic_id": "counter-state",
  "title": "Counter state",
  "status": "learning",
  "selection": "accepted",
  "updated_from_lesson_id": "lesson-0001",
  "evidence_refs": [
    {
      "lesson_id": "lesson-0001",
      "evidence_id": "evidence-01"
    }
  ],
  "gaps": [
    "The learner did not explain the state change without help."
  ],
  "review": {
    "last_review_lesson_id": null,
    "next_due_on": null
  }
}
